{"image_version":1,"id":"render.grey","frame":"raw:320x200:flat","frame_identity":"sha256:0000000000000000000000000000000000000000000000000000000000000000","role":"rendering","rendering_role":"mask_input","pixel_digest":"sha256:0000000000000000000000000000000000000000000000000000000000000004","identity":"sha256:0000000000000000000000000000000000000000000000000000000000000005","file":"0000000000000000000000000000000000000000000000000000000000000005.png"}
