{"image_version":1,"id":"inputs.image","frame":"raw:320x200:flat","frame_identity":"sha256:0000000000000000000000000000000000000000000000000000000000000000","role":"canonical","pixel_digest":"sha256:0000000000000000000000000000000000000000000000000000000000000002","identity":"sha256:0000000000000000000000000000000000000000000000000000000000000003","file":"0000000000000000000000000000000000000000000000000000000000000003.png"}
